{
  "bkt_events": [
    {
      "auditable": true,
      "composite_label": "allow",
      "composite_score": 0.15,
      "conversation_id": "bootstrap-conv-001",
      "depth": {
        "label": "low",
        "reason": "depth match ratio: 0.15",
        "score": 0.15
      },
      "domain": "unknown",
      "event_id": "5a748a13-8c2b-dc01-546b-230405357e0f",
      "model_trace": null,
      "rationale": "Final decision allow due to low dimension in turn 0.",
      "scope": {
        "label": "low",
        "reason": "scope match ratio: 0.15",
        "score": 0.15
      },
      "source_span": {
        "actor": "user",
        "snippet_hashes": [
          "sha256:b4bc6c34c5d405c3dfc3786b1222ea9db60ccad7fb55ab0b4dbcdc2a357d53eb"
        ],
        "turns": [
          0
        ]
      },
      "timestamp_utc": "2026-04-26T20:08:48Z",
      "turn_index": 0,
      "uncertainty": "med",
      "uplift": {
        "label": "low",
        "reason": "uplift match ratio: 0.15",
        "score": 0.15
      },
      "version": "bkt-v1.0"
    },
    {
      "auditable": true,
      "composite_label": "allow",
      "composite_score": 0.15,
      "conversation_id": "bootstrap-conv-001",
      "depth": {
        "label": "low",
        "reason": "depth match ratio: 0.15",
        "score": 0.15
      },
      "domain": "unknown",
      "event_id": "0859b30d-d3b0-934e-f4c5-845efaa36414",
      "model_trace": null,
      "rationale": "Final decision allow due to low dimension in turn 1.",
      "scope": {
        "label": "low",
        "reason": "scope match ratio: 0.15",
        "score": 0.15
      },
      "source_span": {
        "actor": "assistant",
        "snippet_hashes": [
          "sha256:1ddf75dbe247c62090d30f57e6b07985fb15111367ca31e3325556deb59171fb"
        ],
        "turns": [
          1
        ]
      },
      "timestamp_utc": "2026-04-26T20:08:48Z",
      "turn_index": 1,
      "uncertainty": "med",
      "uplift": {
        "label": "low",
        "reason": "uplift match ratio: 0.15",
        "score": 0.15
      },
      "version": "bkt-v1.0"
    },
    {
      "auditable": true,
      "composite_label": "allow",
      "composite_score": 0.166,
      "conversation_id": "bootstrap-conv-001",
      "depth": {
        "label": "low",
        "reason": "depth match ratio: 0.15",
        "score": 0.15
      },
      "domain": "unknown",
      "event_id": "c6fcb637-88f2-8585-afc2-b2a0458d9019",
      "model_trace": null,
      "rationale": "Final decision allow due to low dimension in turn 2.",
      "scope": {
        "label": "low",
        "reason": "scope match ratio: 0.15",
        "score": 0.15
      },
      "source_span": {
        "actor": "user",
        "snippet_hashes": [
          "sha256:6b186ab65098fa6069f601db219b2c032555e000fddf16385a20d8d05e050781"
        ],
        "turns": [
          2
        ]
      },
      "timestamp_utc": "2026-04-26T20:08:48Z",
      "turn_index": 2,
      "uncertainty": "med",
      "uplift": {
        "label": "low",
        "reason": "uplift match ratio: 0.23",
        "score": 0.23
      },
      "version": "bkt-v1.0"
    },
    {
      "auditable": true,
      "composite_label": "allow",
      "composite_score": 0.15,
      "conversation_id": "bootstrap-conv-001",
      "depth": {
        "label": "low",
        "reason": "depth match ratio: 0.15",
        "score": 0.15
      },
      "domain": "unknown",
      "event_id": "5567873c-e22e-b61e-414f-d2d446898dd2",
      "model_trace": null,
      "rationale": "Final decision allow due to low dimension in turn 3.",
      "scope": {
        "label": "low",
        "reason": "scope match ratio: 0.15",
        "score": 0.15
      },
      "source_span": {
        "actor": "assistant",
        "snippet_hashes": [
          "sha256:84a58eb5ad64d3e880eeb1a172f207144521a7663f3a2cae1039318091057a5d"
        ],
        "turns": [
          3
        ]
      },
      "timestamp_utc": "2026-04-26T20:08:48Z",
      "turn_index": 3,
      "uncertainty": "med",
      "uplift": {
        "label": "low",
        "reason": "uplift match ratio: 0.15",
        "score": 0.15
      },
      "version": "bkt-v1.0"
    }
  ],
  "conversation_id": "bootstrap-conv-001",
  "decision": "allow",
  "decision_hash": "91e9fd673f26747850410e1babf99b72b39fc06918de54ee176775409de31a42",
  "decision_reason": "Final decision allow due to low dimension in turn 2.",
  "generated_at_utc": "2026-04-26T20:08:48Z",
  "host_context": {
    "artifact_version": "mvp-0.1.0",
    "contract_version": "bkt-v1.0",
    "host_id": "bioguard-host-1",
    "skill_id": "bioguard-bio-trace"
  },
  "model_id": "gpt-5.4",
  "policy_profile": {
    "include_bio_seq": false,
    "include_session_context": true,
    "mode": "review",
    "threshold_allow": 0.45,
    "threshold_review": 0.75
  },
  "request_id": "f48cccba-b551-9396-3f6e-a4f3d65dc416",
  "request_ts_utc": "2026-04-26T20:08:48Z"
}
